{
  "alert_id": "quota_alert_sync_egress_env_123_80pct",
  "policy_id": "quota_sync_egress_env_123",
  "organization_id": "org_123",
  "project_id": "project_123",
  "environment_id": "env_123",
  "metric": "sync_egress_bytes",
  "threshold_basis_points": 8000,
  "current_quantity": 8192,
  "limit_quantity": 10000,
  "window_seconds": 2592000,
  "state": "firing",
  "last_evaluated_at": "2026-05-18 10:00:00+00",
  "fired_at": "2026-05-18 10:00:00+00",
  "resolved_at": null
}
